SubjNo, List, Story, PerPress, Mask, Position, Text, RT
65, 3, sharper, 0, False, 0, sharper, 417590.389013
65, 3, sentence, 1, True, 0, I, 1502.65693665
65, 3, sentence, 1, True, 1, am, 1045.01795769
65, 3, sentence, 1, True, 2, not, 526.365041733
65, 3, sentence, 1, True, 3, a, 388.578176498
65, 3, sentence, 1, True, 4, happy, 362.697124481
65, 3, sentence, 1, True, 5, man., 478.33108902
65, 3, sentence, 1, True, 6, Humanity, 627.215862274
65, 3, sentence, 1, True, 7, does, 339.087963104
65, 3, sentence, 1, True, 8, not, 453.603982925
65, 3, sentence, 1, True, 9, ask, 420.862913132
65, 3, sentence, 1, True, 10, us, 506.509065628
65, 3, sentence, 1, True, 11, to, 343.219041824
65, 3, sentence, 1, True, 12, be, 356.323957443
65, 3, sentence, 1, True, 13, happy., 334.895133972
65, 3, sentence, 1, True, 14, It, 324.996948242
65, 3, sentence, 1, True, 15, merely, 405.786037445
65, 3, sentence, 1, True, 16, asks, 338.824987411
65, 3, sentence, 1, True, 17, us, 720.752954483
65, 3, sentence, 1, True, 18, to, 349.766016006
65, 3, sentence, 1, True, 19, be, 391.982078552
65, 3, sentence, 1, True, 20, brilliant, 510.516881943
65, 3, sentence, 1, True, 21, on, 532.67788887
65, 3, sentence, 1, True, 22, its, 339.395999908
65, 3, sentence, 1, True, 23, behalf., 534.41619873
65, 3, sentence, 1, True, 24, Survival, 411.769866943
65, 3, sentence, 1, True, 25, first, 511.792898178
65, 3, sentence, 1, True, 26, then, 381.369113922
65, 3, sentence, 1, True, 27, happiness, 1151.05509758
65, 3, sentence, 1, True, 28, as, 436.892986298
65, 3, sentence, 1, True, 29, we, 344.49505806
65, 3, sentence, 1, True, 30, can, 446.043968201
65, 3, sentence, 1, True, 31, manage, 376.11913681
65, 3, sentence, 1, True, 32, it., 633.364915848
65, 3, practice, 1, True, 0, Life, 711.278915405
65, 3, practice, 1, True, 1, is, 385.343074799
65, 3, practice, 1, True, 2, to, 500.339984894
65, 3, practice, 1, True, 3, be, 363.040924072
65, 3, practice, 1, True, 4, lived, 487.067937851
65, 3, practice, 1, True, 5, not, 406.847000122
65, 3, practice, 1, True, 6, controlled;, 557.236194611
65, 3, practice, 1, True, 7, and, 453.184843063
65, 3, practice, 1, True, 8, humanity, 425.666093826
65, 3, practice, 1, True, 9, is, 400.192022324
65, 3, practice, 1, True, 10, won, 432.755947113
65, 3, practice, 1, True, 11, by, 357.239961624
65, 3, practice, 1, True, 12, continuing, 514.626979828
65, 3, practice, 1, True, 13, to, 686.563968658
65, 3, practice, 1, True, 14, play, 451.092004776
65, 3, practice, 1, True, 15, in, 704.388856888
65, 3, practice, 1, True, 16, face, 503.603935242
65, 3, practice, 1, True, 17, of, 399.443864822
65, 3, practice, 1, True, 18, certain, 441.349029541
65, 3, practice, 1, True, 19, defeat., 377.183914185
65, 3, practice2, 1, True, 0, We, 1432.45911598
65, 3, practice2, 1, True, 1, were, 461.873054504
65, 3, practice2, 1, True, 2, the, 392.607212067
65, 3, practice2, 1, True, 3, people, 464.933156967
65, 3, practice2, 1, True, 4, who, 349.803924561
65, 3, practice2, 1, True, 5, were, 442.15798378
65, 3, practice2, 1, True, 6, not, 403.049945831
65, 3, practice2, 1, True, 7, in, 389.807939529
65, 3, practice2, 1, True, 8, the, 290.337085724
65, 3, practice2, 1, True, 9, papers., 558.552980423
65, 3, practice2, 1, True, 10, We, 459.347009659
65, 3, practice2, 1, True, 11, lived, 405.732870102
65, 3, practice2, 1, True, 12, in, 450.985908508
65, 3, practice2, 1, True, 13, the, 350.522041321
65, 3, practice2, 1, True, 14, blank, 511.39998436
65, 3, practice2, 1, True, 15, white, 402.041912079
65, 3, practice2, 1, True, 16, spaces, 447.829008102
65, 3, practice2, 1, True, 17, at, 390.156984329
65, 3, practice2, 1, True, 18, the, 356.763839722
65, 3, practice2, 1, True, 19, edges, 453.345060349
65, 3, practice2, 1, True, 20, of, 323.776006699
65, 3, practice2, 1, True, 21, print., 490.994930267
65, 3, practice2, 1, True, 22, It, 428.688049316
65, 3, practice2, 1, True, 23, gave, 345.448970795
65, 3, practice2, 1, True, 24, us, 365.962982178
65, 3, practice2, 1, True, 25, more, 424.571990967
65, 3, practice2, 1, True, 26, freedom., 437.564134598
65, 3, practice2, 1, True, 27, We, 354.747056961
65, 3, practice2, 1, True, 28, lived, 360.528945923
65, 3, practice2, 1, True, 29, in, 403.074026108
65, 3, practice2, 1, True, 30, the, 318.031072617
65, 3, practice2, 1, True, 31, gaps, 420.261144638
65, 3, practice2, 1, True, 32, between, 339.879989624
65, 3, practice2, 1, True, 33, stories., 401.968955994
65, 3, up, 5, True, 0, The longest smoke break of, 1324.04398918
65, 3, up, 5, True, 1, Nicholas Whites life began at, 1359.91501808
65, 3, up, 5, True, 2, around eleven oclock on a, 822.21698761
65, 3, up, 5, True, 3, Friday night in October 1999., 1632.68899918
65, 3, up, 5, True, 4, White a thirty four year, 932.875156403
65, 3, up, 5, True, 5, old production manager at Business, 731.132984161
65, 3, up, 5, True, 6, Week working late on a, 840.872049332
65, 3, up, 5, True, 7, special supplement had just watched, 591.964960098
65, 3, up, 5, True, 8, the Braves beat the Mets, 754.426956177
65, 3, up, 5, True, 9, on a television in the, 688.675165176
65, 3, up, 5, True, 10, office pantry. Now he wanted, 661.310911179
65, 3, up, 5, True, 11, a cigarette. He told a, 530.732870102
65, 3, up, 5, True, 12, colleague hed be right back, 447.200059891
65, 3, up, 5, True, 13, and leaving behind his jacket, 462.135076523
65, 3, up, 5, True, 14, headed downstairs. The magazines offices, 541.47195816
65, 3, up, 5, True, 15, were on the forty third, 444.067001343
65, 3, up, 5, True, 16, floor of the McGraw Hill, 641.09992981
65, 3, up, 5, True, 17, Building an unadorned tower added, 681.240797043
65, 3, up, 5, True, 18, to Rockefeller Center in 1972., 784.343004227
65, 3, up, 5, True, 19, When White finished his cigarette, 512.407064438
65, 3, up, 5, True, 20, he returned to the lobby, 424.041032791
65, 3, up, 5, True, 21, and waved along by a, 492.787122726
65, 3, up, 5, True, 22, janitor buffing the terrazzo floors, 730.209112167
65, 3, up, 5, True, 23, got into Car No. 30, 1049.82089996
65, 3, up, 5, True, 24, and pressed the button marked, 552.730083466
65, 3, up, 5, True, 25, 43. The car accelerated. It, 562.618017197
65, 3, up, 5, True, 26, was an express elevator with, 565.398931503
65, 3, up, 5, True, 27, no stops below the thirty, 682.03496933
65, 3, up, 5, True, 28, ninth floor and the building, 634.432077408
65, 3, up, 5, True, 29, was deserted. But after a, 509.662866592
65, 3, up, 5, True, 30, moment White felt a jolt., 485.774040222
65, 3, up, 5, True, 31, The lights went out and, 558.76493454
65, 3, up, 5, True, 32, immediately flashed on again. And, 578.859090805
65, 3, up, 5, True, 33, then the elevator stopped. The, 454.782009125
65, 3, up, 5, True, 34, control panel made a beep, 455.374002457
65, 3, up, 5, True, 35, and White waited a moment, 563.634157181
65, 3, up, 5, True, 36, expecting a voice to offer, 916.589021683
65, 3, up, 5, True, 37, information or instructions. None came., 514.345884323
65, 3, up, 5, True, 38, He pressed the intercom button, 1036.37599945
65, 3, up, 5, True, 39, but there was no response., 402.463912964
65, 3, up, 5, True, 40, He hit it again and, 733.771800995
65, 3, up, 5, True, 41, then began pacing around the, 517.945051193
65, 3, up, 5, True, 42, elevator. After a time he, 708.357095718
65, 3, up, 5, True, 43, pressed the emergency button setting, 883.967876434
65, 3, up, 5, True, 44, off an alarm bell mounted, 774.278879166
65, 3, up, 5, True, 45, on the roof of the, 1099.69687462
65, 3, up, 5, True, 46, elevator car but he could, 527.396917343
65, 3, up, 5, True, 47, tell that its range was, 523.53310585
65, 3, up, 5, True, 48, limited. Still he rang it, 556.421041489
65, 3, up, 5, True, 49, a few more times and, 462.84198761
65, 3, up, 5, True, 50, eventually pulled the button out, 482.205867767
65, 3, up, 5, True, 51, so that the alarm was, 455.222129822
65, 3, up, 5, True, 52, continuous. Some time passed although, 652.899026871
65, 3, up, 5, True, 53, he was not sure how, 460.783004761
65, 3, up, 5, True, 54, much because he had no, 579.317808151
65, 3, up, 5, True, 55, watch or cell phone. He, 490.01288414
65, 3, up, 5, True, 56, occupied himself with thoughts of, 419.850111008
65, 3, up, 5, True, 57, remaining calm and decided that, 446.144104004
65, 3, up, 5, True, 58, hed better not do anything, 377.087831497
65, 3, up, 5, True, 59, drastic because whatever the malfunction, 541.991949081
65, 3, up, 5, True, 60, he thought it unwise to, 456.18391037
65, 3, up, 5, True, 61, jostle the car and because, 802.434206009
65, 3, up, 5, True, 62, he wanted to be as, 499.957799911
65, 3, up, 5, True, 63, he thought chuckling to himself, 724.873065948
65, 3, up, 5, True, 64, a model trapped employee. He, 695.379972458
65, 3, up, 5, True, 65, hoped once someone came to, 470.658063889
65, 3, up, 5, True, 66, get him to appear calm, 510.859966278
65, 3, up, 5, True, 67, and collected. He did not, 537.528991699
65, 3, up, 5, True, 68, want to be scolded for, 484.777212143
65, 3, up, 5, True, 69, endangering himself or harming company, 567.25692749
65, 3, up, 5, True, 70, property. Nor did he want, 1138.02099228
65, 3, up, 5, True, 71, to be caught smoking should, 572.322130203
65, 3, up, 5, True, 72, the doors suddenly open so, 505.144119263
65, 3, up, 5, True, 73, he didnt touch his cigarettes., 480.296850204
65, 3, up, 5, True, 74, He still had three plus, 411.276817322
65, 3, up, 5, True, 75, two Rolaids which he worried, 530.626058578
65, 3, up, 5, True, 76, might dehydrate him so he, 604.931116104
65, 3, up, 5, True, 77, left them alone. As the, 637.689113617
65, 3, up, 5, True, 78, emergency bell rang and rang, 581.595182419
65, 3, up, 5, True, 79, he began to fear that, 452.189922333
65, 3, up, 5, True, 80, it might somehow electricity? friction?, 714.349985123
65, 3, up, 5, True, 81, heat? start a fire. Recently, 704.28609848
65, 3, up, 5, True, 82, there had been a small, 434.816122055
65, 3, up, 5, True, 83, fire in the building rendering, 568.88794899
65, 3, up, 5, True, 84, the elevators unusable. The Business, 936.475992203
65, 3, up, 5, True, 85, Week staff had walked down, 526.401996613
65, 3, up, 5, True, 86, forty three stories. He also, 607.712984085
65, 3, up, 5, True, 87, began hearing unlikely oscillations in, 688.005924225
65, 3, up, 5, True, 88, the ringing: aural hallucinations. Before, 677.675008774
65, 3, up, 5, True, 89, long he began to contemplate, 448.215961456
65, 3, up, 5, True, 90, death. Ask a vertical transportation, 622.072935104
65, 3, up, 5, True, 91, industry professional to recall an, 574.31101799
65, 3, up, 5, True, 92, episode of an elevator in, 846.863985062
65, 3, up, 5, True, 93, free fall the cab plummeting, 716.123819351
65, 3, up, 5, True, 94, in the shaftway frayed rope, 567.559957504
65, 3, up, 5, True, 95, ends trailing in the dark, 706.130027771
65, 3, up, 5, True, 96, and he will say that, 421.971082687
65, 3, up, 5, True, 97, he can think of only, 441.680192947
65, 3, up, 5, True, 98, one. That would be the, 627.811908722
65, 3, up, 5, True, 99, Empire State Building incident of, 483.395814896
65, 3, up, 5, True, 100, 1945 in which a B, 591.588973999
65, 3, up, 5, True, 101, 25 bomber pilot made a, 1639.69802856
65, 3, up, 5, True, 102, wrong turn in the fog, 454.608917236
65, 3, up, 5, True, 103, and crashed into the seventy, 508.439064026
65, 3, up, 5, True, 104, ninth floor snapping the hoist, 611.571073532
65, 3, up, 5, True, 105, and safety cables of two, 602.808952332
65, 3, up, 5, True, 106, elevators. Both of them plunged, 577.969074249
65, 3, up, 5, True, 107, to the bottom of the, 650.429010391
65, 3, up, 5, True, 108, shaft. One of them fell, 651.421070099
65, 3, up, 5, True, 109, from the seventy fifth floor, 602.419137955
65, 3, up, 5, True, 110, with a woman aboard an, 510.544061661
65, 3, up, 5, True, 111, elevator operator. The operator of, 492.475986481
65, 3, up, 5, True, 112, the other one had stepped, 529.119968414
65, 3, up, 5, True, 113, out for a cigarette. By, 487.749099731
65, 3, up, 5, True, 114, the time the car crashed, 564.226865768
65, 3, up, 5, True, 115, into the buffer in the, 533.138036728
65, 3, up, 5, True, 116, pit a hydraulic truncheon designed, 633.594989777
65, 3, up, 5, True, 117, to be a cushion of, 458.10508728
65, 3, up, 5, True, 118, last resort a thousand feet, 463.032007217
65, 3, up, 5, True, 119, of cable had piled up, 522.281885147
65, 3, up, 5, True, 120, beneath it serving as a, 426.258802414
65, 3, up, 5, True, 121, kind of spring. A pillow, 702.27098465
65, 3, up, 5, True, 122, of air pressure as the, 543.763875961
65, 3, up, 5, True, 123, speeding car compressed the air, 626.044034958
65, 3, up, 5, True, 124, in the shaft may have, 678.323984146
65, 3, up, 5, True, 125, helped ease the impact as, 432.190179825
65, 3, up, 5, True, 126, well. Still the landing was, 540.528059006
65, 3, up, 5, True, 127, not soft. The cars walls, 528.746843338
65, 3, up, 5, True, 128, buckled and steel debris tore, 422.204971313
65, 3, up, 5, True, 129, up through the floor. It, 382.736206055
65, 3, up, 5, True, 130, was the womans good fortune, 450.577020645
65, 3, up, 5, True, 131, to be cowering in a, 439.300060272
65, 3, up, 5, True, 132, corner when the car hit., 513.476133347
65, 3, up, 5, True, 133, She was severely injured but, 678.506135941
65, 3, up, 5, True, 134, alive. Traction elevators the ones, 478.246927261
65, 3, up, 5, True, 135, hanging from ropes as opposed, 451.002120972
65, 3, up, 5, True, 136, to dumbwaiters or mining elevators, 650.951147079
65, 3, up, 5, True, 137, or those lifted by hydraulic, 559.74817276
65, 3, up, 5, True, 138, pumps are typically borne aloft, 767.605066299
65, 3, up, 5, True, 139, by six or eight hoist, 1505.91492653
65, 3, up, 5, True, 140, cables each of which according, 489.70413208
65, 3, up, 5, True, 141, to the national elevator safety, 779.93106842
65, 3, up, 5, True, 142, code and the code determines, 582.53121376
65, 3, up, 5, True, 143, all is capable on its, 496.182203293
65, 3, up, 5, True, 144, own of supporting the full, 846.050977707
65, 3, up, 5, True, 145, load of the elevator plus, 449.428081512
65, 3, up, 5, True, 146, twenty five per cent more, 402.542114258
65, 3, up, 5, True, 147, weight. Another line the governor, 445.300102234
65, 3, up, 5, True, 148, cable is connected to a, 458.373069763
65, 3, up, 5, True, 149, device that detects if the, 261.273145676
65, 3, up, 5, True, 150, elevator car is descending at, 447.499990463
65, 3, up, 5, True, 151, a rate twenty five per, 418.354988098
65, 3, up, 5, True, 152, cent faster than its maximum, 463.397026062
65, 3, up, 5, True, 153, designed speed. If that happens, 391.984939575
65, 3, up, 5, True, 154, the device trips the safeties, 476.395130157
65, 3, up, 5, True, 155, bronze shoes that run along, 466.026067734
65, 3, up, 5, True, 156, vertical rails in the shaft., 454.716920853
65, 3, up, 5, True, 157, These brakes are designed to, 272.246837616
65, 3, up, 5, True, 158, stop the car quickly but, 232.084035873
65, 3, up, 5, True, 159, not so abruptly as to, 383.263111115
65, 3, up, 5, True, 160, cause injury. They work. This, 731.910228729
65, 3, up, 5, True, 161, is why free falling at, 552.097082138
65, 3, up, 5, True, 162, least is so rare. Still, 478.936910629
65, 3, up, 5, True, 163, elevator lore has its share, 375.936031342
65, 3, up, 5, True, 164, of horrors: strandings manglings fires, 483.047962189
65, 3, up, 5, True, 165, drownings decapitations. An estimated two, 511.059045792
65, 3, up, 5, True, 166, hundred people were killed in, 444.895029068
65, 3, up, 5, True, 167, elevators at the World Trade, 622.184991837
65, 3, up, 5, True, 168, Center on September 11 2001, 948.857069016
65, 3, up, 5, True, 169, some probably in free fall, 548.417806625
65, 3, up, 5, True, 170, plunges but many by fire, 533.02192688
65, 3, up, 5, True, 171, smoke or entrapment and subsequent, 557.902097702
65, 3, up, 5, True, 172, structural collapse. The elevator industry, 501.492977142
65, 3, up, 5, True, 173, likes to insist that short, 701.123952866
65, 3, up, 5, True, 174, of airplane rammings most accidents, 596.58908844
65, 3, up, 5, True, 175, are the result of human, 468.891859055
65, 3, up, 5, True, 176, error of passengers or workers, 559.737920761
65, 3, up, 5, True, 177, doing things they should not., 452.200174332
65, 3, up, 5, True, 178, Trying to run in through, 551.081895828
65, 3, up, 5, True, 179, closing doors is asking for, 790.684938431
65, 3, up, 5, True, 180, trouble; so is climbing up, 542.100906372
65, 3, up, 5, True, 181, into an elevator car or, 512.833118439
65, 3, up, 5, True, 182, down out of one when, 761.745929718
65, 3, up, 5, True, 183, it is stuck between floors, 652.834177017
65, 3, up, 5, True, 184, or letting a piece of, 420.376062393
65, 3, up, 5, True, 185, equipment get lodged in the, 514.269113541
65, 3, up, 5, True, 186, brake as happened to a, 555.617809296
65, 3, up, 5, True, 187, service elevator at 5 Times, 526.365995407
65, 3, up, 5, True, 188, Square in Manhattan four years, 663.761138916
65, 3, up, 5, True, 189, ago causing the counterweight to, 1108.52813721
65, 3, up, 5, True, 190, plummet the counterweight which aids, 862.795114517
65, 3, up, 5, True, 191, an elevators rise and slows, 778.412818909
65, 3, up, 5, True, 192, its descent is typically forty, 902.673006058
65, 3, up, 5, True, 193, per cent heavier than an, 525.744915009
65, 3, up, 5, True, 194, empty car and the elevator, 668.310880661
65, 3, up, 5, True, 195, to shoot up at sixty, 827.672958374
65, 3, up, 5, True, 196, miles an hour into the, 462.72110939
65, 3, up, 5, True, 197, beams at the top of, 521.046876907
65, 3, up, 5, True, 198, the shaft killing the attendant, 604.227781296
65, 3, up, 5, True, 199, inside. Loading up an empty, 429.388999939
65, 3, up, 5, True, 200, elevator car with discarded Christmas, 1013.4780407
65, 3, up, 5, True, 201, trees pressing the button for, 453.240156174
65, 3, up, 5, True, 202, the top floor then throwing, 469.142913818
65, 3, up, 5, True, 203, in a match so that, 463.912963867
65, 3, up, 5, True, 204, by the time the car, 416.870117188
65, 3, up, 5, True, 205, reaches the top it is, 427.397012711
65, 3, up, 5, True, 206, ablaze with heat so intense, 523.257017136
65, 3, up, 5, True, 207, that the alloy called babbitt, 879.16302681
65, 3, up, 5, True, 208, connecting the cables to the, 430.369138718
65, 3, up, 5, True, 209, car melts and the car, 467.9210186
65, 3, up, 5, True, 210, a fireball now plunges into, 183.515071869
65, 3, up, 5, True, 211, the pit: this practice apparently, 562.775850296
65, 3, up, 5, True, 212, popular in New York City, 463.000059128
65, 3, up, 5, True, 213, housing projects is inadvisable., 507.019042969
65, 3, grammar, 1, False, 0, Epic, 1118.94798279
65, 3, grammar, 1, False, 1, Games, 623.833179474
65, 3, grammar, 1, False, 2, is, 461.874008179
65, 3, grammar, 1, False, 3, a, 423.686027527
65, 3, grammar, 1, False, 4, privately, 453.516960144
65, 3, grammar, 1, False, 5, owned, 410.037994385
65, 3, grammar, 1, False, 6, company, 618.638038635
65, 3, grammar, 1, False, 7, and, 435.768842697
65, 3, grammar, 1, False, 8, does, 430.222988129
65, 3, grammar, 1, False, 9, not, 421.478033066
65, 3, grammar, 1, False, 10, disclose, 610.932826996
65, 3, grammar, 1, False, 11, its, 519.258022308
65, 3, grammar, 1, False, 12, earnings., 682.134866714
65, 3, grammar, 1, False, 13, But, 537.894964218
65, 3, grammar, 1, False, 14, on, 454.326152802
65, 3, grammar, 1, False, 15, a, 520.762205124
65, 3, grammar, 1, False, 16, Monday, 475.736856461
65, 3, grammar, 1, False, 17, morning, 1322.55792618
65, 3, grammar, 1, False, 18, in, 422.204017639
65, 3, grammar, 1, False, 19, late, 377.043962479
65, 3, grammar, 1, False, 20, April, 446.838140488
65, 3, grammar, 1, False, 21, while, 2180.85002899
65, 3, grammar, 1, False, 22, standing, 447.300195694
65, 3, grammar, 1, False, 23, in, 512.027025223
65, 3, grammar, 1, False, 24, Epics, 450.315952301
65, 3, grammar, 1, False, 25, parking, 526.245117188
65, 3, grammar, 1, False, 26, lot, 403.105974197
65, 3, grammar, 1, False, 27, at, 425.189971924
65, 3, grammar, 1, False, 28, Crossroads, 504.115104675
65, 3, grammar, 1, False, 29, Corporate, 634.160995483
65, 3, grammar, 1, False, 30, Park, 746.602058411
65, 3, grammar, 1, False, 31, in, 532.181024551
65, 3, grammar, 1, False, 32, Cary, 723.169088364
65, 3, grammar, 1, False, 33, North, 560.185909271
65, 3, grammar, 1, False, 34, Carolina, 988.861083984
65, 3, grammar, 1, False, 35, awaiting, 495.316982269
65, 3, grammar, 1, False, 36, the, 469.679832458
65, 3, grammar, 1, False, 37, arrival, 3189.61691856
65, 3, grammar, 1, False, 38, of, 441.528081894
65, 3, grammar, 1, False, 39, Cliff, 466.595888138
65, 3, grammar, 1, False, 40, Bleszinski, 2267.79198647
65, 3, grammar, 1, False, 41, the, 458.645105362
65, 3, grammar, 1, False, 42, companys, 540.448904037
65, 3, grammar, 1, False, 43, thirty, 528.614997864
65, 3, grammar, 1, False, 44, three, 513.272047043
65, 3, grammar, 1, False, 45, year, 407.058000565
65, 3, grammar, 1, False, 46, old, 402.582168579
65, 3, grammar, 1, False, 47, design, 428.03311348
65, 3, grammar, 1, False, 48, director, 463.747024536
65, 3, grammar, 1, False, 49, I, 474.456071854
65, 3, grammar, 1, False, 50, realized, 442.785024643
65, 3, grammar, 1, False, 51, that, 410.016059875
65, 3, grammar, 1, False, 52, my, 431.312799454
65, 3, grammar, 1, False, 53, surroundings, 405.976057053
65, 3, grammar, 1, False, 54, were, 424.058914185
65, 3, grammar, 1, False, 55, their, 410.901069641
65, 3, grammar, 1, False, 56, own, 434.263944626
65, 3, grammar, 1, False, 57, sort, 451.015949249
65, 3, grammar, 1, False, 58, of, 403.481006622
65, 3, grammar, 1, False, 59, Nasdaq., 2026.57818794
65, 3, grammar, 1, False, 60, Ten, 662.828207016
65, 3, grammar, 1, False, 61, feet, 794.389009476
65, 3, grammar, 1, False, 62, away, 595.998048782
65, 3, grammar, 1, False, 63, was, 725.691080093
65, 3, grammar, 1, False, 64, a, 719.082832336
65, 3, grammar, 1, False, 65, red, 586.887121201
65, 3, grammar, 1, False, 66, Hummer, 1047.43599892
65, 3, grammar, 1, False, 67, H3., 859.508037567
65, 3, grammar, 1, False, 68, Nearby, 1057.11984634
65, 3, grammar, 1, False, 69, was, 480.223894119
65, 3, grammar, 1, False, 70, a, 426.989078522
65, 3, grammar, 1, False, 71, Lotus, 479.799032211
65, 3, grammar, 1, False, 72, Elise, 947.854042053
65, 3, grammar, 1, False, 73, and, 538.600921631
65, 3, grammar, 1, False, 74, next, 508.296012878
65, 3, grammar, 1, False, 75, to, 501.262903214
65, 3, grammar, 1, False, 76, it, 463.183879852
65, 3, grammar, 1, False, 77, a, 529.852867126
65, 3, grammar, 1, False, 78, pumpkin, 570.055007935
65, 3, grammar, 1, False, 79, orange, 643.404006958
65, 3, grammar, 1, False, 80, Porsche., 980.426073074
65, 3, grammar, 1, False, 81, Many, 526.964902878
65, 3, grammar, 1, False, 82, of, 454.463005066
65, 3, grammar, 1, False, 83, the, 367.407798767
65, 3, grammar, 1, False, 84, cars, 355.118989944
65, 3, grammar, 1, False, 85, had, 343.480825424
65, 3, grammar, 1, False, 86, personalized, 475.363016129
65, 3, grammar, 1, False, 87, plates:, 399.323940277
65, 3, grammar, 1, False, 88, PS3CODER, 2146.99697495
65, 3, grammar, 1, False, 89, a, 457.346916199
65, 3, grammar, 1, False, 90, reference, 434.015035629
65, 3, grammar, 1, False, 91, to, 374.716043472
65, 3, grammar, 1, False, 92, Sonys, 434.560060501
65, 3, grammar, 1, False, 93, PlayStation3, 1530.81488609
65, 3, grammar, 1, False, 94, EPICBOY, 1099.9250412
65, 3, grammar, 1, False, 95, GRSOFWAR., 4230.50999641
65, 3, grammar, 1, False, 96, The, 471.140861511
65, 3, grammar, 1, False, 97, last, 368.564844131
65, 3, grammar, 1, False, 98, is, 340.413093567
65, 3, grammar, 1, False, 99, shorthand, 416.360855103
65, 3, grammar, 1, False, 100, for, 361.930847168
65, 3, grammar, 1, False, 101, Gears, 449.747800827
65, 3, grammar, 1, False, 102, of, 337.023973465
65, 3, grammar, 1, False, 103, War, 363.177776337
65, 3, grammar, 1, False, 104, a, 393.600940704
65, 3, grammar, 1, False, 105, shooter, 388.376951218
65, 3, grammar, 1, False, 106, game, 367.406129837
65, 3, grammar, 1, False, 107, which, 362.280130386
65, 3, grammar, 1, False, 108, Epic, 346.410036087
65, 3, grammar, 1, False, 109, released, 607.004880905
65, 3, grammar, 1, False, 110, in, 353.842973709
65, 3, grammar, 1, False, 111, November, 361.749887466
65, 3, grammar, 1, False, 112, 2006, 373.419046402
65, 3, grammar, 1, False, 113, for, 446.110963821
65, 3, grammar, 1, False, 114, play, 524.431943893
65, 3, grammar, 1, False, 115, on, 393.005847931
65, 3, grammar, 1, False, 116, Microsofts, 604.506015778
65, 3, grammar, 1, False, 117, Xbox, 439.404010773
65, 3, grammar, 1, False, 118, 360, 385.618925095
65, 3, grammar, 1, False, 119, console., 1409.15513039
65, 3, grammar, 1, False, 120, Gears, 462.723970413
65, 3, grammar, 1, False, 121, of, 348.759174347
65, 3, grammar, 1, False, 122, War, 477.494001389
65, 3, grammar, 1, False, 123, was, 597.83411026
65, 3, grammar, 1, False, 124, quickly, 1066.94698334
65, 3, grammar, 1, False, 125, recognized, 539.088964462
65, 3, grammar, 1, False, 126, as, 428.180932999
65, 3, grammar, 1, False, 127, the, 382.004976273
65, 3, grammar, 1, False, 128, first, 387.964963913
65, 3, grammar, 1, False, 129, game, 410.139083862
65, 3, grammar, 1, False, 130, to, 411.690950394
65, 3, grammar, 1, False, 131, provide, 415.043115616
65, 3, grammar, 1, False, 132, the, 424.936056137
65, 3, grammar, 1, False, 133, sensually, 434.855937958
65, 3, grammar, 1, False, 134, overwhelming, 439.727067947
65, 3, grammar, 1, False, 135, experience, 436.571121216
65, 3, grammar, 1, False, 136, for, 456.596851349
65, 3, grammar, 1, False, 137, which, 474.509954453
65, 3, grammar, 1, False, 138, the, 414.716005325
65, 3, grammar, 1, False, 139, console, 418.209791183
